{
  "interfaceVersion": "1.0.1",
  "executionProfile": "direct-wallet-authorized",
  "operationId": "paycard.settle",
  "capability": "paycard.settle",
  "lifecycleState": "FAILED",
  "authorizationClass": "WALLET_TRANSACTION",
  "subject": { "walletAddress": "0x1111111111111111111111111111111111111111", "role": "payer" },
  "network": { "networkId": "arc-testnet", "chainId": "5042002" },
  "data": null,
  "transaction": {
    "interfaceVersion": "1.0.1",
    "status": "REVERTED",
    "network": { "networkId": "arc-testnet", "chainId": "5042002" },
    "txHash": "0x2222222222222222222222222222222222222222222222222222222222222222",
    "financialEffect": "NONE",
    "failureCode": "TRANSACTION_REVERTED",
    "failureReason": "Vault state rejected the settlement transition.",
    "submittedAt": "2026-08-02T00:00:00Z",
    "observedAt": "2026-08-02T00:00:00Z"
  },
  "errors": [{
    "interfaceVersion": "1.0.1",
    "code": "TRANSACTION_REVERTED",
    "message": "The settlement transaction was mined but reverted.",
    "retryable": true,
    "financialEffect": "NONE",
    "lifecycleState": "FAILED",
    "transactionState": "REVERTED",
    "operationId": "paycard.settle",
    "details": { "reason": "Vault state rejected the settlement transition." },
    "occurredAt": "2026-08-02T00:00:00Z",
    "provenance": { "source": "network-observation", "authority": "Arc RPC", "evidenceLevel": "runtime-observed", "observedAt": "2026-08-02T00:00:00Z", "repository": "Jaydearcadian/mcosm-OpenRails", "commit": "e153dca6d46a8531c3ad45aad5906dbf0a2088ed", "evidenceRefs": ["EVD-OR-004"] }
  }],
  "provenance": { "source": "network-observation", "authority": "Arc RPC", "evidenceLevel": "runtime-observed", "observedAt": "2026-08-02T00:00:00Z", "repository": "Jaydearcadian/mcosm-OpenRails", "commit": "e153dca6d46a8531c3ad45aad5906dbf0a2088ed", "evidenceRefs": ["EVD-OR-004"] },
  "createdAt": "2026-08-02T00:00:00Z",
  "updatedAt": "2026-08-02T00:00:00Z"
}
