{
  "interfaceVersion": "1.1.0",
  "executionProfile": "direct-wallet-authorized",
  "operationId": "paycard.settle",
  "capability": "paycard.settle",
  "lifecycleState": "SETTLED",
  "authorizationClass": "WALLET_TRANSACTION",
  "subject": { "walletAddress": "0x1111111111111111111111111111111111111111", "role": "payer" },
  "network": { "networkId": "arc-testnet", "chainId": "5042002" },
  "data": {
    "interfaceVersion": "1.1.0",
    "id": "paycard:arc:1",
    "executionProfile": "direct-wallet-authorized",
    "network": { "networkId": "arc-testnet", "chainId": "5042002" },
    "vaultAddress": "0x2222222222222222222222222222222222222222",
    "paycardId": "0x1111111111111111111111111111111111111111111111111111111111111111",
    "asset": { "symbol": "USDC", "decimals": 6, "address": "0x3600000000000000000000000000000000000000", "kind": "erc20" },
    "payer": "0x1111111111111111111111111111111111111111",
    "recipient": "0x3333333333333333333333333333333333333333",
    "settlementShape": "one-time",
    "fundedAmount": "1000000",
    "settledAmount": "1000000",
    "status": "SETTLED",
    "transaction": {
      "interfaceVersion": "1.1.0",
      "status": "CONFIRMED",
      "network": { "networkId": "arc-testnet", "chainId": "5042002" },
      "txHash": "0xaaaaaaaaaaaaaaaaaaaaaaaaaaaaaaaaaaaaaaaaaaaaaaaaaaaaaaaaaaaaaaaa",
      "blockHash": "0xcccccccccccccccccccccccccccccccccccccccccccccccccccccccccccccccc",
      "nonce": "1",
      "blockNumber": "100",
      "confirmations": "1",
      "submittedAt": "2026-08-02T00:00:00Z",
      "confirmedAt": "2026-08-02T00:00:02Z",
      "observedAt": "2026-08-02T00:00:03Z",
      "financialEffect": "RECONCILIATION_REQUIRED"
    },
    "canonicalState": {
      "status": "MATCHED",
      "observedAt": "2026-08-02T00:00:03Z",
      "vaultRecordHash": "0xbbbbbbbbbbbbbbbbbbbbbbbbbbbbbbbbbbbbbbbbbbbbbbbbbbbbbbbbbbbbbbbb",
      "expectedFundedAmount": "1000000",
      "actualFundedAmount": "1000000"
    },
    "createdAt": "2026-08-02T00:00:00Z",
    "provenance": {
      "source": "network-observation",
      "authority": "Arc Vault",
      "evidenceLevel": "runtime-observed",
      "observedAt": "2026-08-02T00:00:03Z",
      "repository": "Jaydearcadian/mcosm-OpenRails",
      "commit": "e153dca6d46a8531c3ad45aad5906dbf0a2088ed",
      "evidenceRefs": ["EVD-OR-004"]
    }
  },
  "transaction": {
    "interfaceVersion": "1.1.0",
    "status": "CONFIRMED",
    "network": { "networkId": "arc-testnet", "chainId": "5042002" },
    "txHash": "0xaaaaaaaaaaaaaaaaaaaaaaaaaaaaaaaaaaaaaaaaaaaaaaaaaaaaaaaaaaaaaaaa",
    "blockHash": "0xcccccccccccccccccccccccccccccccccccccccccccccccccccccccccccccccc",
    "nonce": "1",
    "blockNumber": "100",
    "confirmations": "1",
    "submittedAt": "2026-08-02T00:00:00Z",
    "confirmedAt": "2026-08-02T00:00:02Z",
    "observedAt": "2026-08-02T00:00:03Z",
    "financialEffect": "RECONCILIATION_REQUIRED"
  },
  "receipts": [
    {
      "interfaceVersion": "1.1.0",
      "id": "receipt:arc:1",
      "executionProfile": "direct-wallet-authorized",
      "receiptType": "SETTLEMENT",
      "operationId": "paycard.settle",
      "network": { "networkId": "arc-testnet", "chainId": "5042002" },
      "transaction": {
        "interfaceVersion": "1.1.0",
        "status": "CONFIRMED",
        "network": { "networkId": "arc-testnet", "chainId": "5042002" },
        "txHash": "0xaaaaaaaaaaaaaaaaaaaaaaaaaaaaaaaaaaaaaaaaaaaaaaaaaaaaaaaaaaaaaaaa",
        "blockHash": "0xcccccccccccccccccccccccccccccccccccccccccccccccccccccccccccccccc",
        "blockNumber": "100",
        "confirmedAt": "2026-08-02T00:00:02Z",
        "observedAt": "2026-08-02T00:00:03Z",
        "financialEffect": "RECONCILIATION_REQUIRED"
      },
      "receiptStatus": "VERIFIED",
      "financialOutcome": "RECONCILED",
      "verification": {
        "status": "VERIFIED",
        "reasons": [],
        "exact": {
          "eventIndex": "0",
          "contractAddress": "0x941C8029F0f912df3fAb7423890ab2359b996D0b",
          "eventName": "SettlementFlushed",
          "eventSignature": "SettlementFlushed(bytes32,address,uint256)",
          "observedValuesHash": "0xdddddddddddddddddddddddddddddddddddddddddddddddddddddddddddddddd"
        }
      },
      "canonicalReconciliation": {
        "status": "MATCHED",
        "observedAt": "2026-08-02T00:00:03Z",
        "vaultRef": { "type": "PaycardStream", "id": "paycard:arc:1", "network": { "networkId": "arc-testnet", "chainId": "5042002" } },
        "expectedAmount": "1000000",
        "actualAmount": "1000000",
        "stateHash": "0xbbbbbbbbbbbbbbbbbbbbbbbbbbbbbbbbbbbbbbbbbbbbbbbbbbbbbbbbbbbbbbbb"
      },
      "amount": "1000000",
      "asset": { "symbol": "USDC", "decimals": 6, "address": "0x3600000000000000000000000000000000000000", "kind": "erc20" },
      "provenance": {
        "source": "network-observation",
        "authority": "Arc Vault",
        "evidenceLevel": "runtime-observed",
        "observedAt": "2026-08-02T00:00:03Z",
        "repository": "Jaydearcadian/mcosm-OpenRails",
        "commit": "e153dca6d46a8531c3ad45aad5906dbf0a2088ed",
        "evidenceRefs": ["EVD-OR-004"]
      },
      "createdAt": "2026-08-02T00:00:03Z"
    }
  ],
  "errors": [],
  "provenance": {
    "source": "network-observation",
    "authority": "Jaydearcadian/mcosm-OpenRails",
    "evidenceLevel": "runtime-observed",
    "observedAt": "2026-08-02T00:00:03Z",
    "repository": "Jaydearcadian/mcosm-OpenRails",
    "commit": "e153dca6d46a8531c3ad45aad5906dbf0a2088ed",
    "evidenceRefs": ["EVD-OR-004"]
  },
  "createdAt": "2026-08-02T00:00:00Z",
  "updatedAt": "2026-08-02T00:00:03Z"
}
